Department,Category,Title,Specific Destination & Description,Link
Charente (16),Adventurous/Sporty,River Descent,Rent a kayak or canoe from a base like Jarnac Canoe or Cognac Canoë to paddle the scenic Charente River.,Others/activity_ims/RiverDescentCharente.jpg
Charente (16),Adventurous/Sporty,Track Rider,Pedal a unique rail bike on a beautiful route with Velo Rail Charente-Limousine (near Roumazières-Loubert).,Others/activity_ims/TrackRiderCharente.jpg
Charente (16),Adventurous/Sporty,Canopy Climb,Tackle high ropes courses and zip lines at Feel Nature Parc Aventure (in the forest near Angoulême) or similar parks.,Others/activity_ims/CanopyClimbCharente.jpg
Charente (16),Foody,Golden Spirit,"Visit a prestigious producer like Hennessy, Martell, or the family-owned Cognac Raby for a tour and tasting.",Others/activity_ims/GoldenSpiritCharente.jpg
Charente (16),Foody,Sunset Aperitif,Sample Pineau des Charentes and Cognac at a dedicated vineyard like Domaine de Beaulieu (Germignac) or Vignoble Vincent (Oléron).,Others/activity_ims/SunsetAperitifCharente.jpg
Charente (16),Foody,Escargot Delight,Seek out traditional dishes like Cagouilles (snails) at a local restaurant or market in a town like Angoulême or Cognac.,Others/activity_ims/EscargotDelightCharente.jpg
Charente (16),Relaxing,Turquoise Oasis,Take a peaceful walk and picnic at the stunning turquoise Lacs Bleus de Guizengeard (near the border of Charente-Maritime).,Others/activity_ims/TurquoiseOasisCharente.jpg
Charente (16),Relaxing,Gourmet Market,Wander through the beautiful Art Deco Les Halles d'Angoulême covered market for local produce.,Others/activity_ims/GourmetMarketCharente.jpg
Charente (16),Relaxing,Waterside Repose,Relax by the Plan d'Eau de la Grande Prairie lake at Saint-Yrieix-sur-Charente (just outside Angoulême).,Others/activity_ims/WatersideReposeCharente.jpg
Charente (16),History & Culture,Fairytale Castle,Explore the magnificent architecture of the Château de la Rochefoucauld.,Others/activity_ims/FairytaleCastleCharente.jpg
Charente (16),History & Culture,Stone Grotto,"Discover the unique monolithic Saint-Jean Church in Aubeterre-sur-Dronne, carved into a cliff.",Others/activity_ims/StoneGrottoCharente.jpg
Charente (16),History & Culture,Comic Masterpiece,Visit the Cité Internationale de la Bande Dessinée et de l'Image (Comic Strip Museum) in Angoulême.,Others/activity_ims/ComicMasterpieceCharente.jpg
Charente-Maritime (17),Adventurous/Sporty,Island Pedals,Rent a bicycle at Saint-Martin-de-Ré or Ars-en-Ré to explore the extensive cycle paths of Île de Ré.,Others/activity_ims/IslandPedalsCharente-Maritime.jpg
Charente-Maritime (17),Adventurous/Sporty,Coastal Adrenalin,"Book a jet-ski, kitesurf, or windsurf session from a water sports base in La Rochelle or Royan.",Others/activity_ims/CoastalAdrenalinCharente-Maritime.jpg
Charente-Maritime (17),Adventurous/Sporty,Treetop Trek,Experience the high-ropes courses and forest trails at Parc Aventure de Fontdouce (near Saint-Bris-des-Bois).,Others/activity_ims/TreetopTrekCharente-Maritime.jpg
Charente-Maritime (17),Foody,Briny Treasure,Stop for an oyster tasting at the La Cité de l'Huître (Marennes) or one of the cabanes along the Chenal de la Cayenne.,Others/activity_ims/BrinyTreasureCharente-Maritime.jpg
Charente-Maritime (17),Foody,Saffron Mussels,Enjoy a bowl of Mouclade at a traditional restaurant on the Vieux Port in La Rochelle.,Others/activity_ims/SaffronMusselsCharente-Maritime.jpg
Charente-Maritime (17),Foody,Salt Worker,Buy high-quality sea salt and fleur de sel directly from a producer like Sauniers de l'Île de Ré.,Others/activity_ims/SaltWorkerCharente-Maritime.jpg
Charente-Maritime (17),Relaxing,Atlantic Sand,Spend a leisurely day at a large beach like Plage de la Grande Côte (Royan) or Plage des Saumonards (Île d'Oléron).,Others/activity_ims/AtlanticSandCharente-Maritime.jpg
Charente-Maritime (17),Relaxing,Island Sanctuary,"Take a ferry to the car-free, peaceful Île d'Aix for a relaxed day trip.",Others/activity_ims/IslandSanctuaryCharente-Maritime.jpg
Charente-Maritime (17),Relaxing,Sea Wellness,Book a revitalizing thalassotherapy or spa treatment at Thalazur Thalassothérapie in Royan.,Others/activity_ims/SeaWellnessCharente-Maritime.jpg
Charente-Maritime (17),History & Culture,Medieval Harbour,"Climb the Tour Saint-Nicolas, Tour de la Chaîne, and Tour de la Lanterne in La Rochelle.",Others/activity_ims/MedievalHarbourCharente-Maritime.jpg
Charente-Maritime (17),History & Culture,Fortress Glory,Discover the UNESCO-listed Vauban Fortifications and the Citadel in Saint-Martin-de-Ré.,Others/activity_ims/FortressGloryCharente-Maritime.jpg
Charente-Maritime (17),History & Culture,Imperial Past,Explore the Gallo-Roman Amphitheatre and the Abbaye aux Dames in Saintes.,Others/activity_ims/ImperialPastCharente-Maritime.jpg
Vienne (86),Adventurous/Sporty,Screen Thrills,"Spend a day at the Futuroscope theme park, known for its cutting-edge cinematic attractions.",Others/activity_ims/ScreenThrillsVienne.jpg
Vienne (86),Adventurous/Sporty,Aqua Sports,"Enjoy sailing, kayaking, or paddleboarding at the Haut-Poitou Sailing Center on the Lac de Saint-Cyr.",Others/activity_ims/AquaSportsVienne.jpg
Vienne (86),Adventurous/Sporty,Rural Roam,Rent a bike and follow the scenic routes of the Vélo Francette itinerary near Châtellerault.,Others/activity_ims/RuralRoamVienne.jpg
Vienne (86),Foody,Poitou Break,"Purchase the local cake, Broyé du Poitou, from a boulangerie in Poitiers or Montmorillon.",Others/activity_ims/PoitouBreakVienne.jpg
Vienne (86),Foody,Pyramid Cheese,Sample Chabichou du Poitou goat cheese directly from a local farm or a market in Poitiers.,Others/activity_ims/PyramidCheeseVienne.jpg
Vienne (86),Foody,Sweet Legacy,Taste the unique macaron and learn its history at the Maison du Macaron in Montmorillon.,Others/activity_ims/SweetLegacyVienne.jpg
Vienne (86),Relaxing,Riverside Chill,Stroll and relax along the Ilot Tison area by the Clain river in the city of Poitiers.,Others/activity_ims/RiversideChillVienne.jpg
Vienne (86),Relaxing,Cliffside Village,Wander through the stunning medieval village of Angles-sur-l'Anglin (Plus Beaux Villages de France).,Others/activity_ims/CliffsideVillageVienne.jpg
Vienne (86),Relaxing,Wetland Calm,Take a peaceful walk through the unique ecosystems of the Réserve Naturelle Nationale du Pinail (near Vouneuil-sur-Vienne).,Others/activity_ims/WetlandCalmVienne.jpg
Vienne (86),History & Culture,Ancient Murals,Visit the UNESCO-listed Saint-Savin-sur-Gartempe Abbey to see its famous Romanesque frescoes.,Others/activity_ims/AncientMuralsVienne.jpg
Vienne (86),History & Culture,Eagle Display,Explore the medieval town of Chauvigny and watch the spectacular falconry show at the Château des Évêques.,Others/activity_ims/EagleDisplayVienne.jpg
Vienne (86),History & Culture,Regional Antiquity,Discover local history and fine arts at the Musée Sainte-Croix in Poitiers.,Others/activity_ims/RegionalAntiquityVienne.jpg
Deux-Sèvres (79),Adventurous/Sporty,Green Glide,Rent a barque (flat-bottomed boat) or canoe from a loueur like Cardinaud in Coulon to navigate the Marais Poitevin.,Others/activity_ims/GreenGlideDeux-Sèvres.jpg
Deux-Sèvres (79),Adventurous/Sporty,Gorge Plunge,Get an adrenaline rush with a Bungee Jumping experience at the Viaduc de Coquilleau (near Breuil-Barret) with a company like Elastic Crocodil Bungee.,Others/activity_ims/GorgePlungeDeux-Sèvres.jpg
Deux-Sèvres (79),Foody,Cream Gold,Visit the village of Échiré (near Niort) to see the famous Échiré Butter Dairy and buy products at the local shop (visitor centre info can be limited).,Others/activity_ims/CreamGoldDeux-Sèvres.jpg
Deux-Sèvres (79),Foody,Black Dome,"Try Tourteau Fromagé, a distinctive local cheesecake, available at most bakeries (boulangeries) and markets in Niort.",Others/activity_ims/BlackDomeDeux-Sèvres.jpg
Deux-Sèvres (79),Foody,Goat Delights,Sample artisanal goat cheeses like Mothais-sur-Feuille at a local farm like Chèvrerie de Bougon or a Niort market.,Others/activity_ims/GoatDelightsDeux-Sèvres.jpg
Deux-Sèvres (79),Relaxing,Niort Flow,Take a leisurely walk along the Sèvre Niortaise River and around the green spaces near the Donjon de Niort.,Others/activity_ims/NiortFlowDeux-Sèvres.jpg
Deux-Sèvres (79),History & Culture,Niort Legacy,"Explore the impressive Donjon de Niort (Niort Keep), a 12th-century fortress and museum.",Others/activity_ims/NiortLegacyDeux-Sèvres.jpg
Deux-Sèvres (79),History & Culture,Ancient Wealth,"Tour the ancient, accessible Melle Silver Mines (Mines d'Argent des Rois Francs).",Others/activity_ims/AncientWealthDeux-Sèvres.jpg
Deux-Sèvres (79),Adventurous/Sporty,Zoodyssée,"Chizé National ForestFull summer opening hours for this fantastic European wildlife park. Perfect for a long, shaded forest walk to see bears, wolves, and lynxes.",Others/activity_ims/ZoodysséeDeux-Sèvres.jpg
Deux-Sèvres (79),History & Culture,Parthenay by Lantern Light,"ParthenayThe medieval town of Parthenay often runs special Nocturnal Lantern Tours (Visite Nocturne à la Lanterne) in August, offering a unique, atmospheric evening exploration of its cobbled streets and history.",Others/activity_ims/ParthenaybyLanternLightDeux-Sèvres.jpg
Deux-Sèvres (79),History & Culture,Melle Romanesque Churches & Mines,MelleVisit the trio of remarkable Romanesque churches (a UNESCO World Heritage Site).,Others/activity_ims/MelleRomanesqueChurches&MinesDeux-Sèvres.jpg
